f such correlations in the form of planetary-scale temperature patterns throughout the troposphere (with amplitudes exceeding 1°C in some cases). Kodera (1993) showed, by examining running correlations, that undersampling is not the origin of the Lab

 of TNn events (Li et al., 2020; Annex). Median increase of more than 4.5°C in the 50-year TXx and TNn events compared to the 1°C warming level (Li et al., 2020) and more than 5.5°C in annual TXx and TNn compared to pre-industrial (Annex). Additional

 of TNn events (Li et al., 2020; Annex). Median increase of more than 0.5°C in the 50-year TXx and TNn events compared to the 1°C warming level (Li et al., 2020) and more than 1.5°C in annual TXx and TNn compared to pre-industrial (Annex). CMIP6 mode

ranges (5 to 95%) for the TCR estimated by different studies (see text). The grey shaded range marks the very likely range of 1°C to 2.5°C for TCR and the grey solid line represents the extremely unlikely <3°C upper bound as assessed in this section.

, water and transport) ( high confidence ). {3.4.5, 3.4.8} Poverty and disadvantage have increased with recent warming (about 1°C) and are expected to increase for many populations as average global temperatures increase from 1°C to 1.5°C and higher 

f evidence from observed climate change indicate that there is high confidence that ECS is extremely unlikely to be less than 1°C and medium confidence that the ECS is likely to be between 1.5°C and 4.5°C and very unlikely greater than 6°C. These ass

arikko (1996) used crop models to demonstrate a poleward shift in Finnish potential cereal cultivation by 100–150 km for each 1°C increase in mean annual temperature. Reyenga et al. (1999) indicate that climate change accompanied by a doubling of CO 

ia. The depth of the active layer (in loamy soils) is expected to increase by nearly 1 m (Figure 7.4a). Within Canada under a 1°C and 2°C increase in global temperature, responses within permafrost similar in magnitude to those for the USSR are sugge

 positive relationship with temperature, notifications of salmonellosis notifications are projected to increase 15% for every 1°C increase in average monthly temperatures (Britton et al., 2010a). Water-borne zoonotic diseases such as cryptosporidiosi

ities, ecosystems and sectors, and poses significant risks to natural and human systems as compared to the current warming of 1°C (high confidence) (see Chapter 3, Section 3.4, Box 3.4, Box 3.5, Table 3.5, Cross-Chapter Box 6 in Chapter 3). Table 5.2

g a 1.5°C temperature limit along the median-median case are nearly 4% (range 2–7%) by 2100. Avoided damages from achieving a 2°C temperature limit are only 3.5% (range 1.8–6.5%). Avoided damages from achieving 1.5°C versus 2°C are modest at about 0.

maximum and minimum temperatures over equatorial eastern Africa show a significant increase in the number of days warmer than 2°C above the 1981–2000 average by the middle and end of the 21st century under the A1B and A2 scenarios (Anyah and Qiu, 201

 stronger increases at 2°C global warming, and there is a global tendency towards increases in heavy precipitation on land at 2°C compared with 1.5°C warming ( high confidence ). Overall, regions that display statistically significant changes in heav

strial levels ( high confidence ) . For oceans, regional surface temperature means and extremes are projected to be higher at 2°C compared to 1.5°C of global warming ( high confidence ). Temperature means and extremes are also projected to be higher 

i-d-17-0096.1. 10 Mukherjee, S. and V. Mishra, 2018: A sixfold rise in concurrent day and night-time heatwaves in India under 2°C 11 warming.. Scientific reports , 8(1) , 16922, doi:10.1038/s41598-018-35348-w. 12 Mukherjee, S., A. Mishra, and K.E. Tr

levels) and scenarios that reach 480 to 530 ppm CO 2 -eq by 2100 (without overshoot: more likely than not to limit warming to 2°C above pre-industrial levels). Summary for Policymakers 31 SPM Financial resources for adaptation have become available m

 70 million hec tares versus a loss on the southern margin of ap proximately 170 million hectares. The impacts of a 1°C and a 2°C increase in mean annual global temperature on boreal and tundra ecosystems can also be examined through palaeo- reconstr

in baseline scenarios. By contrast, these emissions are reduced by 80% and 50% relative to 2010 levels in 1.5°C-overshoot and 2°C-consistent pathways from IAMs, respectively (Figure 2.21). By mid- century, CO 2 emissions per unit of electricity are p

18: Will Half a Degree Make a Difference? Robust Projections of Indices of Mean and 12 Extreme Climate in Europe Under 1.5°C, 2°C, and 3°C Global Warming. Geophysical Research Letters , 45(2) , 13 935–944, doi:10.1002/2017gl076222. 14 Dosio, A. et al

marine fisheries of about 1.5 million tonnes for 1.5°C of global warming compared to a loss of more than 3 million tonnes for 2°C of global warming ( medium confidence ). {3.4.4, Box 3.4} B.5 Climate-related risks to health, livelihoods, food securit

nges for the Antarctic ice sheet are complex. A preliminary assessment that assumes an increase in surface air temperature of 3°C and a 12% increase in precipitation during the next 100 years suggests an increase of the Antarctic ice volume of approx

s not consistent with analyses of recent changes in Greenland SMB (see Section 4.6.3.1). For an average temperature change of 3°C over each ice sheet, a combination of four high-resolution AGCM simulations and 18 AR4 AOGCMs (Huybrechts et al., 2004; 

748-9326/11/3/034013. 6 Tobin, I. et al., 2018: Vulnerabilities and resilience of European power generation to 1.5°C, 2°C and 3°C warming. 7 Environmental Research Letters , 13(4) , 044024, doi:10.1088/1748-9326/aab211. 8 Todzo, S., A. Bichet, and A.

r, the northern part of the eastern region is projected to warm most while coastal areas are projected to warm by only 2°C to 3°C. The climate change response of RCMs is sometimes different from that of the driving AOGCM. This appears to be the resul

ands is projected to be 3.2°C–4°C, and under 1.5°C of global warming, mean warming in drylands is projected to still be about 3°C. The Fynbos biome in southwestern South Africa is vulnerable to the increasing impact of fires under increasing temperat

in Simulating Present Climate In the Central America (CAM) and AMZ regions, most models in the MMD have a cold bias of 0°C to 3°C, except in AMZ in SON (Supplementary Material Table S11.1). In southern South America (SSA) average biases are close to 

). Under these scenarios, based on the MAGICC calculations, warming is likely to stay below 2°C and very likely to stay below 3°C during the 21st century. This significantly reduces the key risks listed in Table 19-4, as well as others discussed in t

h differ from model to model. Southern Europe (30 o -50°N 10°W-45°E) The warming is about 2°C in winter and varies from 2° to 3°C in summer. There is some indication of increased precipitation in winter, but summer precipitation decreases by 5% to 15

eement, limited evidence ). {9.3.1, 9.4.1, 9.4.2, 9.5.1, 9.5.2, 9.5.3, 9.6.3} 2 3 At sustained warming levels between 2°C and 3°C, the Arctic Ocean will be practically sea ice–free 4 throughout September in most years ( medium confidence ); there is 

mic and Social Dimensions of Climate Cham Table 6.7. Expert opinion on climate change damage Scenario A Scenario B Scenario C 3°C Warming 6°C Warming 6°C Warming by 2090 by 2175 by 2090 Table 6.8. Illustrative damages from long-term climate change, p

the equilibrium rise conesponding to the lorcing at an earlier time For an atmosphenc model vwth a tempciatuie sensitivity of 4°C loi a doubling ol CO2 this constant is appioximately 66% with an oil set of 1 1 years For a sensitivity of 1 5°C, the va

 All coral reefs bleached Loss of 51-65% fynbos, 13-80% of various fauna in S. Africa 16% of global ecosystems transforming > 4°C: Major extinctions around globe (as exemplified for USA and Australia) Loss of 8% freshwater fish habitat in N. America 

 when the cryosphere is involved in river flow. In their snowmelt ranoff simulations, Martinec et al (1994) report that for a 4°C rise in temperature of the Rio Grande basin in the USA, winter ranoff increases from 14% of the total annual flow at pre

 11.21 HERE] 6 7 Table 11.21: Observed trends, human contribution to observed trends, and projected changes at 1.5°C, 2°C and 4°C of global warming for meteorological droughts (MET), 8 agricultural and ecological droughts (AGR/ECOL), and hydrological

ncreasing the fluxes of CH4 and N2O from terrestrial ecosystems to the atmosphere If the noithern wetland soils aie warmed by 4°C, the CH4 flux to the atmosphere could increase by as much as 36 Tg annually It the soil moisture decreases in northern e

by changes in global mean temperature. Often these studies were carried out at a few elevated temperatures—typically, 2°C and 4°C (corresponding to the bulk of the range of IPCC Working Group I SAR equilibrium temperature rise expected for a doubling

°C 4°C Verylow Very high Medium Present 2°C 4°C Verylow Very high Medium Present 2°C 4°C Verylow Very high Medium Present 2°C 4°C Verylow Very high Medium Present 2°C 4°C Verylow Very high Medium Present 2°C 4°C Verylow Very high Medium Near term (20

8°C with a best estimate of 3 3°C This corresponds to a predicted rise from 1990 of 1 6°C to 3 5°C, with a best estimate of 2 4°C 6 Time-Dependent Gi eenhoute-Gas Induced Climate Change 179 6.1 Introduction 6.7.7 Why Coupled Ocean-Atmosphere Models ?

; right panel), respectively; for the CMIP5 subset only the percentile range of 21 temperature is shown, and only for 3°C and 4°C GWLs. Changes are absolute for temperature (in °C) 22 and relative (as %) for precipitation. See Section Atlas.1.3 for m

rongly positive. Koval, 1994 GFDL, Soviet Republics Spring UKMO negative; temperature sensitivity U K MO Wheat alone of 2 and 4°C resulted in yield losses of 20 to 30%; impacts also varied widely across the 19 sites studied Sirotenko and EMI Russia C

ures over the major West Antarctic ice shelves are about as likely as not to pass the melting point if global warming exceeds 5°C, and disintegration might be initiated earlier by surface melting. Observational and modelling studies indicate that bas

ndicate that the sensitivity of global mean suiface iempeiatuie to doubling COT IS unlikely to lie outside the iange 1 5 to 4 5°C There is no compelling evidence to suggest in what part of this range the correct value is most likely to lie There is n

which are even cleaier for the decade 1977- 86 (not shown) This decade had a positive anomaly (relative to 1951 80) ol over 1 5°C in Alaska and negative anomaly of more than 0 75°C in the cential and western Noith Pacific The above changes aie likely

ated to be between 2 2°C and 4 8°C with a best estimate of 3 3°C This corresponds to a predicted rise from 1990 of 1 6°C to 3 5°C, with a best estimate of 2 4°C 6 Time-Dependent Gi eenhoute-Gas Induced Climate Change 179 6.1 Introduction 6.7.7 Why Co

 in river basins with new or aggravated water scarcity is projected to increase with global warming, from 8% at 2°C to 13% at 5°C (Gerten et al., 2013). 3.5.1. Availability of Water Resources About 80% of the world’s population already suffers seriou

) If k/w is held constant, the realized warming varies over this range by about 18% for AT2 X = 4 5°C and bv 8% lor AT2 X = 1 5°C Figure 6 10 shows the effect of terminating the inciease ol forcing after 70 years The response with JU = 1 continues to

 SRES scenarios. These ﬁ gures indicate that a local mean summer warming of 5°C is unlikely for a global warming of less than 5°C (see Appendix 10.A). This suggests that ice shelf collapse due to surface melting is unlikely under most SRES scenarios 

Do Not Cite, Quote or Distribute 1-170 Total pages: 215 than at present. Global surface temperatures have typically varied by 5°C to 7°C through these cycles, with large changes in ice volume and sea level, and temperature changes as great as 10°C to

ether it is virtually certain that ECS is larger than 1.5°C, but currently it is not possible to rule out ECS 23 values above 5°C. Therefore, the 5°C upper end of the very likely range is assessed with medium confidence 24 and the other bounds with h

; updated from Brown, 2000) and the largest reductions in March-April average snow cover occurred roughly between the 0°C and 5°C isotherms (Figure 4.3). The snow-albedo feedback also helps determine the longer-term trends (for temperature see Sectio

enario B b Scenario C c a Scenario A postulated 3°C warming by 2090. b Scenario B postulated scenario A continuing to produce 6°C warming by 2175. c Scenario C postulated 6°C warming by 2090. d Percentage of global world product lost as a result of c

 in Africa are projected to 51 rise faster than the global average increase and likely to increase by more than 2°C and up to 6°C by the end 52 of the century relative to the late 20th century if global warming reaches 2°C (Bindoff et al., 2013; Nian

ncy Of The Observed Global-Mean Warming With The Greenhouse Hypothesis Global-mean temperature has incieased by around 0 3- 0 6°C over the past 80-100 years (see Section 7) At the same time, greenhouse gas concentrations have inci eased substantially

e European Centre for Medium- Range Weather Forecasts 40-year (ERA40) reanalyses with the exception of a cold bias maximum of 6°C to 8°C in the Barents Sea (particularly in winter/spring) caused by overestimated sea ice in this region (Chapman and Wa

tal pages: 196 region, Afghanistan and southwest Pakistan during winter (Iqbal et al., 2017) and substantial cold biases of 1 6°C–10°C are found over the Himalayan watersheds of the Indus Basin (Nengker et al., 2018; Hasson et al., 2 2019). Neither R

s scenarios. This analysis projects increases in the temperature of the 1-in-20 year annual extreme hottest day of about 2 to 6°C (depending on region and scenario; Figure 3-5 adapted from Kharin et al., 2007) and strong reductions in the return peri

 for given warming scenarios. Including thresholds in impact models, for especially high levels of global warming (i.e., 4 to 6°C above preindustrial), are highly likely to result in lower projections of yield, given changes in climate variability an

1 What Do Abrupt Changes in Oceanic and Atmospheric Circulation at Mid- and High- Latitudes Show? An abrupt cooling of 2°C to 6°C identi ﬁ ed as a prominent feature of Greenland ice cores at 8.2 ka (Alley et al., 1997; Alley and Agustsdottir, 2005) i

he 1960s (in green) and 2000s (in blue). The threshold exceeded in 2010 is shown by the solid horizontal line which is almost 6°C above 1960s mean July temperatures, shown by the dashed line. The difference between the green and blue lines could be c

nce been proposed, including 4°C to 5°C based on coral skeleton records from off Barbados (Guilderson et al., 1994) and up to 6°C in the cold tongue off western South America based on foraminiferal assemblages (Mix et al., 1999). New data syntheses f

 regions that are covered by high quality 29 networks such as ECA&D (Flaounas et al., 2012). 30 31 Large differences of up to 7°C between the CRU and UDEL datasets have been found especially over 32 mountainous areas, such as the Atlas in Morocco (Zi

emble under SSP5-8.5. In individual county-level studies on 38 GCM future climate projections temperatures increased by up to 7°C by the end of the century, depending on 39 season and emission scenario (Allaberdiyev, 2010; MENRPG, 2015; Vermishev, 20

bal ocean acidification (Zachos et al., 2005; Ridgwell and Schmidt, 2010) and, with low confidence , global warming of 4°C to 7°C rel- ative to pre-PETM mean climate (Sluijs et al., 2007; McInerney and Wing, 2011). The carbon release of 4500 to 6800 

greater. Considering all models, at the lO\'t-lOe km 2 scale, temperature changes due to CO 2 doubling varied between 0.6 and 7°C and precipitation changes varied between -35 and 50% of control run values, with a marked inter-regional variability. Th

missions scenario and for the 2070-2099 period: up to 9°C for North Africa (Mediterranean coast) in June to August, and up to 7°C for southern Africa in September to November. Regional Climate Model (RCM) experiments generally give smaller temperatur

s, due to the positive feedback from a reduced period of snow cover. The ensemble-mean northern warming varies from more than 7°C in winter (nearly all AOGCMs project a warming exceeding 4°C) to as little as 2°C in summer. In summer, ensemble-mean pr

s and CO 2 are considered as forcings rather than feedbacks, climate records of the past 65 Myr yield an estimate of 1.1°C to 7°C (95% confidence interval) for ECS (PALAEOSENS Project Members, 2012) (see also Sec- tion 5.3.3.2). 5.3.2 Glacial–Intergl

igure 4.19). For RCP8.5/SSP5-8.5 at the end of the century, the 31 mean estimated warming exceeds 5°C in WSB, ESB and RFE and 7°C in some parts ( high confidence ). In 32 most areas of ARP and WCA, 5°C is exceded (Ozturk et al., 2017), but EAS, SAS a

l constraints arising from regionally differentiated warming rates. Tighter ranges of 4°C to 8°C for North America and 4°C to 7°C for Europe are obtained if fractional errors in past global mean temperature are used to scale the future continental ch

ottom water temperatures of lakes, reservoirs, rivers, and estuaries throughout North America consistently increase from 2 to 7°C (based on 2×CO 2 and IS92a scenarios) (Fang and Stefan, 1999; Hostetler and Small, 1999; Nicholls, 1999; Stefan and Fang

usiness-as-Usual Scenario, this gives a warming of 1 3 to 2 6°C from pre-industnal times to present, with a "best guess" of 1 8°C (Section 6.6.2) For Scenario B, these estimates should be reduced by about 15% Although it is hard to justify some of th

WCA a strong warming with marked 50 seasonality for the end of the 21st century, ranging from 2.5°C in winter under RCP4.5 to 8°C in summer 51 under RCP8.5 and with large increases found over high-altitude areas in winter and spring (Bucchignani et 5

change is consistent with mid-range stabilisation scenarios (Chapter 9, Section 9.3.3.1 and Figure 9.17(b)). For a warming of 8°C, they calculate a contribution of about 6 m. Their experiments take into account the effect of concomitant increases in 

ough increased évapotranspi ration. Evapotranspiration and shading effects together can reduce air temperatures by as much as 8°C. In Nanjing, China, for instance, after 34 milhon trees were planted in the late 1940s, average summer temperatures drop

l waters; and two centrarchid species prefer warm waters and tend to "hibernate" in winter when water temperatures fall below 8°C. 0.025 15 20 Temperature (°C) Figure 16-1: Growth rates as a function of temperature. habitat, food supply, predators, p

des and 9 more than 6°C in the Arctic (Figure 4.41g). Under SSP5-8.5, such a very high-warming storyline implies 10 more than 8°C warming over parts of Amazonia and more than 6°C over most other tropical land regions 11 (Figure 4.41h). 12 13 14 [STAR

ter than 5°C when combined with UHI effects. Peak seasonal temperatures could be even higher. Temperature increases of 6°C to 8°C in the Arctic and temperature rise in Antarctica would contribute to sea level rise that would impact coastal cities acr

 cool-water fish—the highest percentages of viable eggs produced were 93% after over-wintering at 4°C, 65% at 6°C, and 31% at 8°C. 10.6.1.3. C o n t a m i n a nt A c c u m u l a t i on Warming of lakes could increase the occurtence of methyl mer cury

Ms over Central Asia projected a larger increase of temperature under RCP8.5 for the 44 2071–2100 period, ranging from 5°C to 8°C (Ozturk et al., 2017). 45 46 In ARP, the projected change in ensemble mean annual temperature from 30 CMIP6 models is fr

h a best estimate of 1 1"C Temperature rise from pre-industrial times to the year 2070 is estimated to be between 2 2°C and 4 8°C with a best estimate of 3 3°C This corresponds to a predicted rise from 1990 of 1 6°C to 3 5°C, with a best estimate of 

urrently available. For the southern 29 and eastern Mediterranean, they project a mean warming ranging from 3°C for RCP4.5 to 9°C for RCP8.5 at 30 the end of this century compared to its beginning (Bucchignani et al., 2018; Ozturk et al., 2018). The 

steenoja et al., 2003) indicate higher levels of warming with the A1FI emissions scenario and for the 2070-2099 period: up to 9°C for North Africa (Mediterranean coast) in June to August, and up to 7°C for southern Africa in September to November. Re

hern forests are cleai from an experiment conducted on a boreal forest in Alaska Experimental heating of the surface soil, to 9°C above ambient temperature for three summers was carried out in black spruce forest (Van Cleve et al 1981) For the entire

sed shallower than 2500 m would tend to rise towards the surface. Because most ocean water in this depth range is colder than 9°C, CO 2 hydrate would tend to form on the droplet wall. Under these conditions, the radius of the droplet would diminish a

a number of general circulation models All models show a significant increase in global- mean temperature which ranges from 1 9°C to 5 2°C As in the perpetual July simulations, cloud feedback probably introduces a large uncertainty, although here it 

lving at a radial speed of about 0.1 cm hr –1 (0.26 to 1.1 µmol cm –2 s –1 ; Teng et al. , 1996). In waters colder than about 9°C, a CO 2 hydrate film could form on the bubble wall. CO 2 diffusers could produce gaseous CO 2 bubbles that are small eno

s ago), atmos- pheric CO 2 concentrations exceeded ~1000 ppm ( medium confidence ) when global mean surface temperatures were 9°C to 14°C ( medium confidence ) higher than for pre-industrial conditions. {5.3.1} New temperature reconstructions and sim

48 Km 2 W" 1 while ATs = 1 9°C The point is that water vapour feedback has amplified the initial global warming of 1 2°C to 1 9°C, 1 e . an amplification factor of 1 6 3.3.3 Snow-Ice Albedo Feedback An additional well-known positive feedback mechanis

GMST during the PETM was 4°C–7°C warmer than pre-PETM mean climate ( low 35 confidence ), and that the EECO and the MPWP were 9°C–14°C and 1.9°C–3.6°C warmer than pre- 36 industrial, respectively ( medium confidence ). The GMST during the LIG was ass

15.3.2 Projected atmospheric changes The areally averaged warming in the Arctic is projected to range from about 2°C to about 9°C by the year 2100, depending on the model and forcing scenario. The projected warming is largest in the northern autumn a

uncertain. Most models assume a nonlinear (convex) damage- temperature relationship, resulting in damages of 6% or higher for 10°C warming. These figures are illustrative only. Doubled-C0 2 damage estimates usually form the basis for the calculation 

an indication that the models tended to overestimate the seasonal temperature cycle. Most biases were in the range of -7°C to 10°C, but values as large as ~ 15°C were found. The smallest biases were found over Australia and, with the exception of one

 can have a profound effect on growth and metabolic processes. Observations show that biological rates double or halve with a 10°C increase or decrease in temperature, respectively. Over the range of temperatures encountered in the ocean ( - 2 to +30

mid-Pliocene Warm Period, sea level was 5–25 29 m higher than 1900 ( medium confidence ); under past global warming levels of 10°C–18°C, like during the 30 Early Eocene, the planet was essentially ice free ( high confidence ). Constraints from these 

es are in most regions less than 1°C. Even over extensive land areas of the NH where the standard deviation generally exceeds 10°C, the models agree with observations within 2°C almost everywhere. The models, as a group, clearly capture the differenc

t al ., 1998). High winter temperatures prevailed for 3.5 to 4 ky after the deglaciation, but then dropped by as much as 6 to 10°C in mid-Eemian times, accompanied by a decrease in precipitation. In Antarctica, the last inter-glacial is also marked b

month) that have increased on average by 5°C per month for the Arctic as a whole (Xu et al., 2013). However, the even greater 10°C to 12°C per month increase for the land adjacent to the Chukchi and Bering Seas (Figure 28-3) was associated with decre

t extra-tropical land regions and Amazonia. Over large parts 50 of the Arctic, annual mean temperatures increase by more than 10°C relative to 1995–2014 in such a high- 51 warming storyline under SSP5-8.5. The two lines of evidence yield more consist

e uncertainty in the 19 tropospheric aerosol forcing, giving ranges of the effective ECS that typically included values above 10°C 20 (Forster, 2016; Knutti et al., 2017). Revised estimates of aerosol forcing together with a larger greenhouse- 21 gas

 time limiting the size of model ensembles, but generally cover the range considered possible by experts, such as from 0°C to 10°C. Note that uniform prior distributions for ECS, which only require an expert assessment of possible range, generally as

