ive forcing efficiencies 1–4 TgS W −1 m 2 yr −1 100–295 Tg dry sea salt W −1 m 2 yr −1 Not known Small on global scale, up to 1°C–3°C on regional scale Amount needed for 1°C overshoot 2–8 TgS yr −1 70 Tg dry sea salt yr −1 Not known 0.04–0.1 albedo c

cy of TNn events (Li et al., 2020; Annex). Median increase of more than 1°C in the 50-year TXx and TNn events compared to the 1°C warming level (Li et al., 2020) and more than 3°C in annual TXx and TNn compared to pre- industrial (Annex). Additional 

he ECS distribution are now better understood. Multiple lines of evidence provide high confidence that an ECS value less than 1°C is extremely unlikely . The assessment that ECS is very unlikely greater than 6°C is an expert judgment informed by seve

cipitation (Li et al., 2020; Annex). Median increase of more than 10% in the 50-year Rx1day and Rx5day events compared to the 1°C warming level (Li et al., 2020a) and more than 15% in annual Rx1day and Rx5day and 10% in annual Rx30day compared to pre

c CO2 levels to minoi climatic changes such as the Little Ice Age, where global mean temperatures probably decreased by about 1°C, is within this range However, the anticipated climatic and environmental changes may soon become large enough to act ba

 of TNn events (Li et al., 2020; Annex). Median increase of more than 4.5°C in the 50-year TXx and TNn events compared to the 1°C warming level (Li et al., 2020) and more than 5.5°C in annual TXx and TNn compared to pre-industrial (Annex). Additional

 be one-half of that suggested by equilib rium analyses due to the influence of increased snow cover. Under global warming of 1°C the most significant changes within the USSR are proposed for the southernmost portions of the permafrost with the bound

requency of TNn events (Li et al., 2020). Median increase of more than 1°C in the 50- year TXx and TNn events compared to the 1°C warming level (Li et al., 2020) CMIP6 models project a robust increase in the intensity and frequency of TXx events and 

d (WGI AR5 Chapter 1), a period during which the increase in the model and scenario averaged GMT is projected to remain below 1°C relative to 1986–2005 (WGI AR5 Figure 11.8; WGI AR5 Section 11.3.6.3). Among the conclusions are, “In most land regions 

1.04% increase in energy demand for the downstate New York utility. Projecting an increase in summer temperature of just over 1°C, they projected a 7.04% increase in peak demand and a 3.4% increase in total energy demand. In an examination of regiona

evel rise (Arnell et al., 2016; Brown et al., 2016, 2018a). Risks from increased flooding are projected to rise from 1.5°C to 2°C of warming ( medium confidence ), with substantial increases projected beyond 2°C (Arnell et al., 2016). Southeast Asia 

, and that climate models project robust differences between present-day and global warming up to 1.5°C and between 1.5°C and 2°C (Hoegh-Guldberg et al. 2018). Direct temperature effects on soils are of two kinds. Firstly, permafrost thawing leads to

ce in their new range, analogous to invasive plants (Macel et al., 2017). In summary, limiting warming to 1.5°C compared with 2°C may avoid advance in spring phenology ( high confidence ) by perhaps a few days ( medium confidence ) and hence decrease

(Section 3.3.9). B. The ‘1.5°C or 2°C emissions scenarios’ presented in Chapter 2 are targeted to hold warming below 1.5°C or 2°C with a certain probability (generally two-thirds) over the course, or at the end, of the 21st century. These scenarios s

 Chapter 1), approximately corresponding (for CIDs that are 9 independent of sea-level rise) to global warming levels between 2°C and 2.4°C (see 12.4 for more details 10 of the assessment method). The table also includes the assessment of observed or

 marked energy demand reductions in modelled 1.5°C pathways, TS Technical Summary 35 comparable and beyond those projected in 2°C pathways. Sectoral models support the scale of these reductions. {2.3.4, 2.4.3, 2.5.1} Links between 1.5°C Pathways and 

and New York, NY, USA, pp. 1499–1566. Mahlstein, I. and R. Knutti, 2012: September Arctic sea ice predicted to disappear near 2°C global warming above present. Journal of Geophysical Research: Atmospheres , 117(D6) , D06104, doi:10.1029/2011jd016709.

 if increases in global average temperature ex- ceed 1.5 to 2.5°C over 1980-1999 levels. Confidence has increased that a 1 to 2°C increase in global mean tem- perature above 1990 levels (about 1.5 to 2.5°C above pre- industrial) poses significant ris

 not diverge substantially across emissions scenarios. Long term differentiates between a global mean temperature increase of 2°C and 4°C above preindustrial levels. For each timeframe, risk levels are estimated for a continuation of current adaptati

igher risks of impacts, with risks being moderate under present-day conditions and becoming high above 0.9°C and very high at 2°C of global warming. High-latitude fisheries are undergoing major transformations, and while production is increasing, pre

efits of climate change at 1°C of warming (Section 10.9.2; Figure 10-1). Little is known about global aggregate damages above 3°C (Sections 10.9.2, 19.5.1; Figure 10-1; Ackerman et al., 2010; Weitzman, 2010; Ackerman and Stanton, 2012; Kopp et al., 2

op yield change. Over 20 million are exposed and vulnerable to crop yield change in SSP3, increasing to 854 million people at 3°C ( low confidence ). Livelihoods deteriorate as a result of these impacts, livelihood migration is accelerated, and strif

 history when mean global temperatures were substantially warmer for a sustained period (estimated by GCMs to be about 2°C to 3°C above pre-industrial temperatures; Chandler et al., 1994; Sloan et al., 1996; Haywood et al., 2000; Jiang et al., 2005),

f in the winter months and considerably less in the traditional spring snow- melt-runoff season. Roos (1990) estimates that a 3°C temperature increase could shift about one-third of the present spring snowmelt into increased winter runoff. Also, the 

end of the 21st century from both the CMIP3 GCMs (SRES A2 and A1B scenarios) and CMIP5 GCMs (RCP4.5 and RCP8.5) range between 3°C and 6°C above the late 20th century baseline (Meehl et al., 2007; Fontaine et al., 2011; Diallo et al., 2012; Monerie et

 an 83% probability for climate sensitivity to be at or below 4.5°C, while the best estimate is for climate sensitivity to be 3°C. The WGIII AR4 organises the stabilisation scenarios literature by the level of stringency of the scenario, setting out 

tions for discount rates of 0% and 3%, but not for 10%. If the optimal temperature increase exceeds pre- industrial levels by 3°C, early reduction is not required. Tol finds that impact costs for the spiky path are typically less than 20% higher than

climate trends and variability Region Country Change in temperature Change in precipitation References North Asia Russia 2 to 3°C rise in past 90 years, more pronounced in spring and winter Highly variable, decrease during 1951 to 1995, increase in l

nts and a robust decrease in the intensity and frequency of TNn events (Li et al., 2020; Annex). Median increase of more than 3°C in the 50-year TXx and TNn events compared to the 1°C warming level (Li et al., 2020) and more than 4.5°C in annual TXx 

e Sheets will be lost almost completely and irreversibly over multiple millennia; At sustained warming levels between 2°C and 3°C, there is limited evidence that the Greenland and West Antarctic Ice Sheets will be lost almost completely and irreversi

°C 4°C Verylow Very high Medium Present 2°C 4°C Verylow Very high Medium Present 2°C 4°C Verylow Very high Medium Present 2°C 4°C Verylow Very high Medium Present 2°C 4°C Verylow Very high Medium Near term (2030–2040) Present Long term (2080–2100) 2°

tential for conﬂict in some regions, drive potential migration of people, and increase humanitarian crises. C O O Present 2°C 4°C Verylow Very high Medium Impacts on shipping and infrastructure for energy and mineral extraction increases as storm int

 of up to 7 m. Current estimates indicate that the threshold is greater than about 1°C ( low confidence ) but less than about 4°C ( medium confidence ) of global warming with respect to pre-industrial temperatures. Abrupt and irreversible ice loss fr

LE 11.9 HERE] 5 6 Table 11.9: Observed trends, human contribution to observed trends, and projected changes at 1.5°C, 2°C and 4°C of global warming for meteorological droughts (MET), 7 agricultural and ecological droughts (AGR/ECOL), and hydrological

sasters through inter-sectoral coordination. Low to medium prospects due to limited human and ﬁnancial resources. Present 2°C 4°C Verylow Very high Medium River/coastal zone systems ( high conﬁdence ) [8.3.3.4] London is currently well protected from

warming. Displayed are (a–d) spatial patterns of change in annual average near-surface 13 temperature at 1.5°C, 2°C, 3°C, and 4°C of global warming relative to the period 1850–1900 and (e–g) 14 spatial patterns of differences in temperature change at

ight panel), 43 respectively; for the CMIP5 subset only the percentile range of temperature is shown, and only for 44 3°C and 4°C GWLs. Changes are absolute for temperature (in °C) and relative (as %) for 45 precipitation. See Section Atlas.1.3 for m

of the assessed risk levels. Continued next page 65 Technical Summary TS Present 2°C 4°C Verylow Very high Medium Present 2°C 4°C Verylow Very high Medium Present 2°C 4°C Verylow Very high Medium Present 2°C 4°C Verylow Very high Medium Present 2°C 4

ions to quantify how yield variability will change in the world’s major maize-producing and exporting countries under 2°C and 4°C of global warming. Tesfaye et al. (2017) projected that the extent of heat-stressed areas in South Asia could increase b

 11.13 HERE] 5 6 Table 11.13: Observed trends, human contribution to observed trends, and projected changes at 1.5°C, 2°C and 4°C of global warming for temperature extremes in Central and 7 South America, subdivided by AR6 regions. See Sections 11.9.

d amount is calculated mteiactively from iclative humidity but in which radiative properties are fixed give a warming of 4 to 5°C (Table 3 2a entiies 3 to 16 21) Even amongst those models which calculate cloud from iclative humidity there is a wide v

eviation after removing linear trends from each time 11 series. Error bars show the 5-95% confidence interval for the warmest 5°C global warming level. Figure 12 adapted from (Pendergrass et al., 2017) and updated with CMIP6 models. Further details o

the climate sensitivity (the response to a doubling of carbon dioxide) is 4 5°C and about 80% if the climate sensitivity is 1 5°C If the forcing were then held constant, temperatures would continue to rise slowly, but it is not certain whether it wou

oupled with a 7% increase in precipitation would be on the order of US$9.5 billion. A scenario with a temperature increase of 5°C coupled with no change in precipitation would result in losses of US$43 billion. Overall, they found that the economic c

at some types of ecosystems have also been trdnsient Foi cxdinple 20 000 30 000 yedis dgo when the Edrth\'s climate was about 5°C colder than present large parts of North America, Europe and Asia were covered by herbaceous vegetation that did not res

ble from region to region and across models. Seasonal temperature biases are typically within the range of ± 4°C but exceed ± 5°C in some regions, particularly in DJF. Precipitation biases are mostly between − 40 and + 80%, but exceed 100% in some re

80–2100 compared to 1995–2014 of between 1°C and 2°C under SSP1-2.6/RCP2.6 15 emissions and exceeding 4°C and in some regions 5°C under SSP5-8.5/RCP8.5 emissions. The central 16 interior of Southern and Northern Africa are likely to warm faster than 

ive to 1961 to 1990. interglacial (the last 10,000 years, known as the Holocene). Changes in annual mean temperature of about 5°C occuned over a few decades, at least in Greenland and the North Atlantic, and were probably linked to changes in oceanic

987) described in 9 4 1 and in Section 6 For each scenario, the model is run using a climate sensitivity (AT2 X ) of 1 5°C, 2 5°C and 4 5°C for the low, best-estimate and high projections, respectively, with the diffusivity set to 0 63cm2sec"\' and j

d for industrial refrigeration applica- tions with evaporation temperatures down to –52°C and con- densing temperatures up to 5°C. CO 2 is also increasingly being used in the low stage of cascade systems for industrial refrig- eration. CO 2 is also c

that northwestern South Asia, including the western Himalayas, are projected 12 to experience temperature increases exceeding 6°C by the end of the 21 st century under SSP5-8.5 relative to 13 1995–2014 (Almazroui et al., 2020c). Results from CMIP5, C

crease of more than 5.5°C in the 50-year TXx and TNn events compared to the 1°C warming level (Li et al., 2020) and more than 6°C in annual TXx and TNn compared to pre-industrial (Annex). Additional evidence from A C C E P T E D V E R S I O N S U B J

o, Ontario), frost penetration will be reduced significantly by 50¬ 60% and 75-85% respectively as a result of an increase of 6°C in the mean annual air temperature (Brown, 1964; DOT, 1968). Regions experiencing seasonally frozen ground undergo many 

nges in runoff for 12 watersheds of 600 km^ to 33 500 km^ Temperature 76 C.VI Hydrology and water resources increases of 2 to 6°C and monthly precipitation increases of 10 to 30 mm were produced by the GISS model. The results showed 20 to 50 % increa

.5°C range, and the grey solid line the extremely unlikely less than 1°C, the grey dashed line the very unlikely greater than 6°C. See Figure 10.20b and Chapter 10 Supplementary Material for full caption and details. Labels refer to studies since AR4

north-central United States, Stefan and Sinokrot (1993) estimate that the predicted summer rise in stream temperature will be 6°C higher if streamside vegetation is lost. In the southem United States, tiie rise in summer stream temperatures is primar

response of river temperatures to increases of air temperature. Globally averaged, air temperature increases of 2°C, 4°C, and 6°C are estimated to lead to increases of annual mean river temperatures of 1.3°C, 2.6°C, and 3.8°C, respectively (van Vliet

to be a global- mean waiming of the lower layers ol the atmospheic In Section 8 13 the observed global mean wanning ol 0 3- 0 6°C ovei the past century or so was compared with model predictions It was noted that the obscived wanning is compatible wit

e below that observed Average regional errors are generally small, with only southeast Asia in winter having a mean error ( 2 6°C) of more than 1 5°C, the models average estimates of the seasonal range are within 1 °C of that observed for each region

er the western and northern regions of the country. The monthly average air temperature was lower than climatic means by 2 to 6°C. The cold condition persisted for two months. Abundant snowfall resulted with 80% of the country’s territory being cover

 about 11,500 years ago, at the end of the Younger Dryas was also very abrupt and central Greenland temperatures increased by 7°C or more in a few decades (Johnsen et al ., 1992; Grootes et al ., 1993; Severinghaus et al ., 1998). Most of the changes

roxy and modelled temperatures has improved since AR5 (Section 45 7.4.4.1.2). Northern high latitude (> 60°N) SSTs were up to 7°C higher than 1850–1900 (Bachem et al., 46 2016; McClymont et al., 2020; Sánchez-Montes et al., 2020), and terrestrial bio

e was a series of rapid (over decades to a century) and apparently large climatic changes in the North Atlantic region (~5 to 7°C in Central Greenland: Johnsen et al., 1992; Dansgaard et al., 1993). These changes may have been global in scale: the me

perature changes of the past million years are the glacial cycles, during which the global mean temperature changed by 4°C to 7°C between ice ages and warm interglacial periods (local changes were much larger, for example near the continental ice she

l constraints arising from regionally differentiated warming rates. Tighter ranges of 4°C to 8°C for North America and 4°C to 7°C for Europe are obtained if fractional errors in past global mean temperature are used to scale the future continental ch

s and CO 2 are considered as forcings rather than feedbacks, climate records of the past 65 Myr yield an estimate of 1.1°C to 7°C (95% confidence interval) for ECS (PALAEOSENS Project Members, 2012) (see also Sec- tion 5.3.3.2). 5.3.2 Glacial–Intergl

be as a whole under RCP8.5 and RCP4.5 (Post et al., 2019). The Arctic warming 29 may be as much as 4°C in the annual mean and 7°C in late autumn under 2°C global warming, regardless of 30 which scenario is considered (Post et al., 2019) ( high confid

ure 12.4). The warm anomalies in June lasted throughout the entire month (increases in monthly mean temperature of up to 6 to 7°C), but July was only slightly warmer than on average (+1 to +3°C), and the highest anomalies were reached between 1st and

ratures above about 35°C (Sherwood and Huber, 2010). Sherwood and Huber (2010) conclude that a global mean warming of roughly 7°C above current temperatures would create small land areas where metabolic heat dissipation would become impossible. An in

include additional costs attributed to abrupt change and increases in global mean temperature for some scenarios in excess of 7°C (Nordhaus, 2006a; Yohe, 2006; Tol and Yohe, 2006). The long-term high-temperature scenarios are due to inclusion of feed

l waters; and two centrarchid species prefer warm waters and tend to "hibernate" in winter when water temperatures fall below 8°C. 0.025 15 20 Temperature (°C) Figure 16-1: Growth rates as a function of temperature. habitat, food supply, predators, p

9) find a maximum Antarctic contribution to global sea level rise of 2.5 mm/yr for an extreme scenario involving a warming of 8°C and a bottom melting rate of 10 m/yr. These figures are upper limits based on results currently available from numerical

change is consistent with mid-range stabilisation scenarios (Chapter 9, Section 9.3.3.1 and Figure 9.17(b)). For a warming of 8°C, they calculate a contribution of about 6 m. Their experiments take into account the effect of concomitant increases in 

dwig et al., 2009). Increasing water temperature has steadily eliminated the Cold Intermediate Layer (CIL; temperatures below 8°C) throughout the Black Sea basin over 1991–2003 ( high confidence ; Oguz et al., 2003). Reduced water column mixing and u

isks that can be avoided with near certainty in a 1.5°C warmer world compared to worlds at higher levels of warming (e.g., an 8°C warming of cold extremes in the Arctic is not reached at 1.5°C of global warming in the multimodel ensemble but could ha

onal variation of surface air temperature The magnitudes of the average errors of the individual models he in the range 2 6±0 8°C, with larger values in winter (3 1°C) than in summer (2 1°C) For the high resolution models, the average is 2 3°C These 

heast Siberia indicating warming of more than 10°C as compared to late Holocene (Velichko et al., 2008). Greenland warming of 8°C ± 4°C at 126 ka is estimated from the new Greenland NEEM ice core, after accounting for ice sheet elevation changes (NEE

st in 22 the tropical upper troposphere, reaching more than 5 °C, and near the surface in the Arctic where warming 23 exceeds 8°C (Figure 4.22). It is likely that the warmer projected GSAT in the unconstrained CMIP6 model 24 ensemble contributes to l

 South America and 43 Amazonia, West Central and Eastern Europe; and Western, Central and Eastern North America, and 44 up to 8°C or more in some Arctic regions. Across each of the continents, higher warming is likely to occur 45 in northern Africa, 

ter than 5°C when combined with UHI effects. Peak seasonal temperatures could be even higher. Temperature increases of 6°C to 8°C in the Arctic and temperature rise in Antarctica would contribute to sea level rise that would impact coastal cities acr

lving at a radial speed of about 0.1 cm hr –1 (0.26 to 1.1 µmol cm –2 s –1 ; Teng et al. , 1996). In waters colder than about 9°C, a CO 2 hydrate film could form on the bubble wall. CO 2 diffusers could produce gaseous CO 2 bubbles that are small eno

. In projections from 30 CMIP5 models, winter warming over ARO varies regionally from 3°C to 41 5°C by mid-century and 5°C to 9°C by late-century under RCP4.5 (AMAP, 2017) ( high confidence ). 42 Averaged over the Arctic and based on 36 CMIP5 models,

urrently available. For the southern 29 and eastern Mediterranean, they project a mean warming ranging from 3°C for RCP4.5 to 9°C for RCP8.5 at 30 the end of this century compared to its beginning (Bucchignani et al., 2018; Ozturk et al., 2018). The 

s ago), atmos- pheric CO 2 concentrations exceeded ~1000 ppm ( medium confidence ) when global mean surface temperatures were 9°C to 14°C ( medium confidence ) higher than for pre-industrial conditions. {5.3.1} New temperature reconstructions and sim

e box "Equilibrium and Realised Climate Change") For the Ball "best-estimate" case in the year 2030, for example, a further 0 9°C rise would be expected, about 0 2°C of which would be realised by 2050 (in addition to changes due to further greenhouse

GMST during the PETM was 4°C–7°C warmer than pre-PETM mean climate ( low 35 confidence ), and that the EECO and the MPWP were 9°C–14°C and 1.9°C–3.6°C warmer than pre- 36 industrial, respectively ( medium confidence ). The GMST during the LIG was ass

a number of general circulation models All models show a significant increase in global- mean temperature which ranges from 1 9°C to 5 2°C As in the perpetual July simulations, cloud feedback probably introduces a large uncertainty, although here it 

pe (Peyron et al., 2005). Temperature reconstructions from polar ice cores indicate strong cooling at high latitudes of about 9°C in Antarctica (Stenni et al., 2001) and about 21°C in Greenland (Dahl-Jensen et al., 1998). The strength and depth exten

he expression for A., this results in AS/ATs = 0 2Wm-2 K \' (Cess et al, 1989), so that X is now 0 48 Km 2 W" 1 while ATs = 1 9°C The point is that water vapour feedback has amplified the initial global warming of 1 2°C to 1 9°C, 1 e . an amplificati

sed shallower than 2500 m would tend to rise towards the surface. Because most ocean water in this depth range is colder than 9°C, CO 2 hydrate would tend to form on the droplet wall. Under these conditions, the radius of the droplet would diminish a

t al ., 1998). High winter temperatures prevailed for 3.5 to 4 ky after the deglaciation, but then dropped by as much as 6 to 10°C in mid-Eemian times, accompanied by a decrease in precipitation. In Antarctica, the last inter-glacial is also marked b

°N 45°N 50°N 0°E 5°E 10°E 15°E 5°W L a t i t u d e s 72.15% of the geographical cells have a temperature regime between 9 and 10°C Longitudes (c) Temperature regime (1960–1981) (e) Warm-temperate pseudo-oceanic species (f) Temperate pseudo-oceanic sp

n be supported (Woodward, 1987). Forests are also usu ally absent where the mean temperature of the warmest month falls below 10°C (Koppen, 1936) or where the temperature sum above a 5°C threshold is less than 350 degree-days (Prenticeef a/., 1992). 

 12 and 16°C (Elliott, 1987). In Pennsylvania, experi mental increases in stteam temperature during autumn—from ambient, near 10°C, to about 16°C—are letiial to 99% of stone- fly {Soyedina carolinensis) larvae (Sweeney and Vannote, 1986). Changes in 

is some\xad times taken to coincide with the Antarctic Convergence, which roughly parallels the mean February air isotherm of 10°C and is the northern boundary of the Antarctic marine ecosystem. The area is managed by the Consultative Parties to the 

ver most extratropical land regions and parts of the Amazon. In the Arctic, annual mean 27 temperatures increase by more than 10°C relative to present-day, corresponding to about 30% more than the 28 best estimate of warming. Even for SSP1-2.6, high-

period 1900-96. but by proximity to the ocean or to one of the numerous inland seas. Annual temperature ranges vary from some 10°C in coastal regions of the United Kingdom and Ireland to about 30°C in Finland and Russia. Annual precipitation totals r

variability. Temperature biases were mostly in the range of ± 5ºC, with several instances of larger biases (even in excess of 10°C). Precipitation biases were mostly in the range of ± 50%, but with a few instances of biases exceeding 100%. The range 

ar acceleration of decay with temperature, approximately equivalent to a doubling of the speci ﬁ c respiration rate for every 10°C warming. This temperature sensitivity is broadly consistent with a long history of lab and ﬁ eld measurements of soil e

n as much as 21°C colder than the pre\xad sent temperature in central Greenland; and that temperatures increased by more than 10°C in a few decades. There is evi\xad dence of an even more rapid change in the precipitation pat\xad tern, rapid reorgani

