 standard error 13 range; Goldner et al., 2014) warmer than 1850–1900. Together, these studies indicate that GMST was 4°C– 14 10°C warmer during the MCO ( medium confidence ). 15 16 For the MPWP, new proxy-based estimates of global sea surface temper

n laboratory gradients, most freshwater fish spend two-thirds of their time within a 4°C range and all of their time within a 10°C range around their preferred optima (Magnuson et al., 1979; Magnuson and DeStasio, 1996). This ability allows them to s

lementary Table S11.2. The largest warming is projected to occur in winter over northern parts of Alaska and Canada, reaching 10°C in the northernmost parts, due to the positive feedback from a reduced period of snow cover. The ensemble-mean northern

e soil over the US Great Plains for at least the ﬁ rst several summer months of their integration produced a warming of about 10°C to 20°C. Williamson et al. (2005), have shown that ﬂ aws in model formulation of thunderstorms can cause excessive evap

t of an open snow albedo value to the winter boreal forest in an NWP led to the prediction of air temperatures that were 5 to 10°C too low over large areas of Canada (Betts et al. , 1998). Work has also been done on the interaction between Sahelian v

mid-Pliocene Warm Period, sea level was 5–25 29 m higher than 1900 ( medium confidence ); under past global warming levels of 10°C–18°C, like during the 30 Early Eocene, the planet was essentially ice free ( high confidence ). Constraints from these 

 can have a profound effect on growth and metabolic processes. Observations show that biological rates double or halve with a 10°C increase or decrease in temperature, respectively, i.e., a of 2. General relationships have been derived for predicting

warming at the start of the Bölling-Alleröd period, or at the end of the Younger Dryas may have occurred at rates as large as 10°C/50 years for a significant part of the Northern Hemisphere. Oxygen isotope measurements in Greenland ice cores demonstr

mes above 50°C. The diurnal temperature range often is large; winter nights in the Namib Desert some\xad times are as cold as 10°C (IPCC 1996, WG II, Section 3.3.1) or lower. Extreme desert systems already experience wide fluctu\xad ations in rainfal

